{
  "schema_version": 2,
  "recording": {
    "id": "synthetic-demo-v1",
    "file_name": "SYNTHETIC DEMO · 30 s · no patient data",
    "file_size_bytes": null,
    "synthetic": true,
    "time_basis": "relative_seconds_from_sample_zero",
    "channels": [
      {
        "id": "ch0",
        "name": "Synthetic ECG I",
        "units": "mV",
        "sample_rate_hz": 500,
        "sample_count": 15000
      },
      {
        "id": "ch1",
        "name": "Synthetic ECG II",
        "units": "mV",
        "sample_rate_hz": 500,
        "sample_count": 15000
      },
      {
        "id": "ch2",
        "name": "Synthetic ECG III",
        "units": "mV",
        "sample_rate_hz": 250,
        "sample_count": 7500
      },
      {
        "id": "ch3",
        "name": "Synthetic plethysmography",
        "units": "a.u.",
        "sample_rate_hz": 125,
        "sample_count": 3750
      },
      {
        "id": "ch4",
        "name": "Synthetic SpO₂",
        "units": "%",
        "sample_rate_hz": 25,
        "sample_count": 750
      },
      {
        "id": "ch5",
        "name": "Synthetic pulse",
        "units": "a.u.",
        "sample_rate_hz": 100,
        "sample_count": 3000
      }
    ]
  },
  "annotations": [],
  "proposals": [],
  "relationships": [],
  "metadata": {},
  "extensions": {}
}
